{"contract_id":"RWO-SEMANTIC-CONTRACT","contract_version":"1.0.0","event_id":"authorization-1","event_type":"WorkReady","payload":{"job_id":"seatv1/sha256/7e792eba8811c01d1a2964207c86c30ab630d2f8afe6c7562d2f24fe24d50787"},"profile_id":"RWO-JCS-IJSON-SAFEINT","profile_version":"1.0.0","schema_id":"AcceptedEventView","schema_version":"1.0.0","source_node_id":"source","stream_id":"stream-eve-one-seat"}
